{
  "$schema": "https://json-schema.org/draft/2020-12/schema",
  "$id": "https://app-builder.local/schemas/capability-provider.schema.json",
  "title": "App Builder Capability and Provider Registry",
  "description": "Governance record for the non-LLM execution capabilities the factory might buy rather than build, and the provider candidates that would be benchmarked against each one. Registration is not adoption and adoption is not readiness. This schema validates config/capability-providers.json; it is not a contract family, because nothing executes against it and generating types for a boundary with no second side would be a type nobody imports.",
  "type": "object",
  "required": ["version", "description", "rules", "capabilities", "providers"],
  "properties": {
    "version": {"const": 1},
    "description": {"type": "string", "minLength": 1},
    "rules": {"type": "array", "minItems": 1, "items": {"type": "string", "minLength": 1}},
    "capabilities": {
      "type": "object",
      "minProperties": 1,
      "propertyNames": {"pattern": "^[a-z0-9]+(?:-[a-z0-9]+)*$"},
      "additionalProperties": {"$ref": "#/$defs/capability"}
    },
    "providers": {
      "type": "object",
      "minProperties": 1,
      "propertyNames": {"pattern": "^[a-z0-9]+(?:-[a-z0-9]+)*$"},
      "additionalProperties": {"$ref": "#/$defs/provider"}
    }
  },
  "additionalProperties": false,
  "$defs": {
    "capability": {
      "type": "object",
      "required": [
        "id",
        "title",
        "criticality",
        "ownedContract",
        "contractRequirements",
        "deterministicAlternativeFirst",
        "independenceRule",
        "adoptionConditions",
        "benchmark",
        "owningAuthority"
      ],
      "properties": {
        "id": {"type": "string", "pattern": "^[a-z0-9]+(?:-[a-z0-9]+)*$"},
        "title": {"type": "string", "minLength": 1},
        "criticality": {
          "enum": ["quality-critical", "quality-supporting", "optional"],
          "description": "quality-critical: a published product's quality depends on it, so it needs more than one benchmarked provider before it reaches a launch path. quality-supporting: its absence degrades a result rather than blocking one. optional: recorded so the architecture does not exclude it, with no consumer."
        },
        "ownedContract": {
          "type": "string",
          "minLength": 1,
          "description": "The artifact App Builder keeps when the provider is replaced. Without this the capability is a purchase rather than a contract."
        },
        "contractRequirements": {
          "type": "array",
          "minItems": 3,
          "items": {"type": "string", "minLength": 1},
          "description": "Capability-specific, deliberately. A raster brief and a crawl request share governance but not shape, and one interface spanning both would describe neither."
        },
        "deterministicAlternativeFirst": {
          "type": "string",
          "minLength": 1,
          "description": "The cheaper route that must be shown insufficient first. Principle 1 in machine-readable form."
        },
        "independenceRule": {"type": "string", "minLength": 1},
        "adoptionConditions": {"type": "array", "minItems": 1, "items": {"type": "string", "minLength": 1}},
        "benchmark": {"type": "string", "minLength": 1},
        "owningAuthority": {"type": "string", "minLength": 1}
      },
      "additionalProperties": false
    },
    "provider": {
      "type": "object",
      "required": [
        "id",
        "capability",
        "vendor",
        "product",
        "hosting",
        "adoption",
        "benchmarkStatus",
        "ready",
        "priceBasis",
        "credentialRef",
        "outputRights",
        "dataRetention",
        "fallback",
        "switchingCost",
        "candidateFor",
        "notes"
      ],
      "properties": {
        "id": {"type": "string", "pattern": "^[a-z0-9]+(?:-[a-z0-9]+)*$"},
        "capability": {"type": "string", "pattern": "^[a-z0-9]+(?:-[a-z0-9]+)*$"},
        "vendor": {"type": "string", "minLength": 1},
        "product": {"type": "string", "minLength": 1},
        "hosting": {"enum": ["hosted-only", "hosted-or-self-hosted", "self-hosted-only", "in-repository"]},
        "adoption": {
          "enum": ["candidate", "conditional-candidate", "incumbent", "adopted", "rejected"],
          "description": "candidate: registered for a benchmark. conditional-candidate: enters the benchmark only if a stated speciality is first demonstrated to be needed. incumbent: the in-repository route others must beat. adopted: won a named benchmark task. rejected: considered and declined."
        },
        "benchmarkStatus": {"enum": ["not-benchmarked", "incumbent-baseline", "benchmarked-lost", "benchmarked-won"]},
        "ready": {
          "type": "boolean",
          "description": "Whether this route is usable today. False for every external provider by construction; true only for an in-repository incumbent that already runs."
        },
        "priceBasis": {
          "type": "string",
          "minLength": 1,
          "description": "How the provider charges, in units rather than amounts. Rates a budget must enforce belong to the budget at run time."
        },
        "credentialRef": {"type": ["string", "null"], "description": "Where a trusted gateway would look. Never a value."},
        "outputRights": {"type": "string", "minLength": 1},
        "dataRetention": {"type": "string", "minLength": 1},
        "fallback": {"type": "array", "uniqueItems": true, "items": {"type": "string", "minLength": 1}},
        "switchingCost": {"type": "string", "minLength": 1},
        "candidateFor": {
          "type": "array",
          "minItems": 1,
          "uniqueItems": true,
          "items": {"type": "string", "minLength": 1},
          "description": "The task classes this provider is registered to compete on. Selection is per task; a provider that wins one has proved nothing about the others."
        },
        "notes": {"type": "string", "minLength": 1}
      },
      "additionalProperties": false
    }
  }
}
