{
  "version": 1,
  "description": "Non-LLM execution capabilities the factory might one day buy rather than build, the contract App Builder keeps when it does, and the provider candidates that would be benchmarked against it. This registry records no delivery status and adopts nothing: `ready` is false for every provider by construction. `config/provider-profiles.json` is deliberately not this file — it is model execution, and its `modelId`, `maxOutputTokens`, `structuredOutput` and `eligibleRoles` fields are meaningless for an image, a crawl or a funnel. `config/adapters.json` is generated-app infrastructure and `config/modules.json` is generated-app features; neither is a home for a factory-side execution backend.",
  "rules": [
    "App Builder owns the capability contract, the quality policy and the acceptance decision. A provider owns one step: brief in, candidate out. Every capability below states the artifact it owns, so replacing a provider changes a request shape and nothing else.",
    "Each capability carries its own contract. `contractRequirements` is capability-specific on purpose: a raster brief needs a focal point and responsive variants, a vector brief needs layer and editability semantics, a crawl needs page identity and robots policy, and behaviour evidence needs a sample size. One shared interface across all of them would be an interface that says nothing.",
    "Registration is not adoption, and adoption is not readiness. A provider enters as `candidate`; it may only reach `adopted` after winning a named task in its capability's benchmark; `ready` stays false until a separate reviewed change turns it on. Three states rather than one boolean, so nothing becomes usable by editing a flag.",
    "Deny by default, and deterministic before paid. `deterministicAlternativeFirst` names the cheaper route that must be shown insufficient before a provider is worth benchmarking at all. A capability with no named deterministic route to beat is not ready to be shopped for.",
    "Providers are selected per capability and per task, never globally. A provider that wins premium raster photography has proved nothing about vector output, typography inside an image, or holding six frames of one project consistent. `benchmarkStatus` is per provider; the winner is per task.",
    "Volatile prices are not architectural truth. `priceBasis` records how a provider charges, in units rather than amounts, because a rate a budget must actually enforce belongs to the budget at run time and would be stale here within weeks.",
    "A credential is a reference. `credentialRef` names where a trusted gateway would look. No value belongs in this file, in any environment file committed beside it, or in an attempt record.",
    "Provider output is data. Everything a provider returns carries `instructionAuthority: none` exactly as external source content does under principle 11, and generated media is synthetic design material rather than evidence about the world.",
    "This registry records no delivery status. `config/factory-status.json` and `docs/ROADMAP.md` own what is done, active and outstanding; `owningAuthority` names the prose authority that owns each capability's reasoning, and this file never becomes a second roadmap.",
    "Capabilities already owned elsewhere are deliberately absent. Database, authentication, storage, deployment, payments, transactional email, notifications, search, localisation, feature flags and analytics instrumentation are generated-app capabilities under `config/modules.json`, `config/adapters.json` and docs/PLATFORM_PARITY_PROGRAMME.md §3. Adding them here would create a second registry for a solved question."
  ],
  "capabilities": {
    "raster-image-generation": {
      "id": "raster-image-generation",
      "title": "Raster image generation",
      "criticality": "quality-critical",
      "ownedContract": "The `ImagePlan` image job in docs/VISUAL_EXCELLENCE.md §5 is the brief and the `AssetCandidate` lane in docs/PLATFORM_PARITY_PROGRAMME.md §2.1 is the return path. The factory owns the brief, the candidate set, the critique that ranks candidates, the acceptance decision, the delivery pipeline and the provenance record.",
      "contractRequirements": [
        "purpose, page and section identity, and the art-direction plan the brief was derived from",
        "subject, composition and the material/lighting language the set must hold to",
        "aspect ratio, target dimensions and crop tolerance",
        "focal point and safe zones, so a crop is computed rather than guessed",
        "required responsive variants and the optimisation the existing asset pipeline will apply",
        "real-versus-generated requirement, and the factual claims the asset may never make",
        "rights and provenance state on the way in and on the way out"
      ],
      "deterministicAlternativeFirst": "Satori with the existing Sharp dependency for social and OG artwork, CSS gradients and shapes for decoration, the static icon pipeline for iconography, and a typography-led art direction that needs no photography at all. docs/VISUAL_EXCELLENCE.md §2 already treats \"no publishable imagery\" as a legitimate strong direction rather than a deficiency.",
      "independenceRule": "At least two benchmarked providers from different vendors must be able to satisfy an accepted asset before generated imagery reaches a launch path. Accepted assets are ingested and cached, so a provider outage degrades new generation rather than an existing product.",
      "adoptionConditions": [
        "A real project records missing publishable imagery as the measured limiting factor on its visual result, per docs/PLATFORM_PARITY_PROGRAMME.md §2.1. An image model being available is not a consumer.",
        "The Ardwell & Roe asset floor cannot be met by the governed input path in examples/visual-excellence/README.md. That path exists and works, so the benchmark is not currently a consumer for building a second one.",
        "The Phase 4D component-vocabulary finding is separately resolved or separately falsified. Generated imagery must never be adopted as an answer to a composition, information-architecture or component-vocabulary defect.",
        "Output rights permit commercial publication of an accepted asset by the business the product belongs to."
      ],
      "benchmark": "docs/PLATFORM_PARITY_PROGRAMME.md §2.1 — scored per task class against the Ardwell & Roe asset plan, not against a leaderboard.",
      "owningAuthority": "docs/VISUAL_EXCELLENCE.md §5, with the provider and pipeline design in docs/PLATFORM_PARITY_PROGRAMME.md §2.1"
    },
    "vector-image-generation": {
      "id": "vector-image-generation",
      "title": "Vector and SVG asset generation",
      "criticality": "quality-critical",
      "ownedContract": "The same `ImagePlan` brief with a vector output requirement. A vector asset is not a raster asset in a different container: the factory accepts it only if the geometry it returns is the geometry a designer could edit.",
      "contractRequirements": [
        "everything the raster brief carries, minus focal point and responsive raster variants",
        "output format and whether the result must remain editable geometry rather than an embedded bitmap",
        "layer, group and path structure, because a single flattened path is not an editable asset",
        "palette constraint to the approved BrandSpec tokens rather than provider-chosen colour",
        "transparency requirement and how the asset behaves at icon sizes",
        "text handling — whether glyphs must remain live text or become outlines, and which font licence permits it"
      ],
      "deterministicAlternativeFirst": "The static icon pipeline in docs/BEST_IN_CLASS_CAPABILITIES.md §3.5 for iconography, and hand-authored or Satori-composed marks for the small number of brand devices a project actually needs. A wordmark set in a licensed typeface is typography, not generation.",
      "independenceRule": "Vector output is where hosted providers differ most, so a single winner is expected here for longer than it is for raster. That makes the deterministic fallback more important rather than less: an unavailable vector provider must degrade to a typographic or icon-pipeline solution, never to a rasterised approximation presented as a vector.",
      "adoptionConditions": [
        "A real project needs an editable vector asset that the icon pipeline and typographic routes genuinely cannot supply.",
        "A candidate provider returns geometry that survives being opened and edited, proved on the `ar-brand-wordmark` class of task rather than claimed."
      ],
      "benchmark": "docs/PLATFORM_PARITY_PROGRAMME.md §2.1, vector task class, measured on editability as well as appearance.",
      "owningAuthority": "docs/VISUAL_EXCELLENCE.md §5"
    },
    "image-editing": {
      "id": "image-editing",
      "title": "Image editing, extension and background treatment",
      "criticality": "quality-supporting",
      "ownedContract": "An edit job over an asset the project already holds and has the rights to change. This is the capability with the sharpest factual boundary in the registry: editing an owner-supplied photograph of real work can silently turn evidence into a claim, so an edit that changes what the picture asserts is refused rather than reviewed.",
      "contractRequirements": [
        "the source asset identity and the rights declaration that permits altering it",
        "the operation — extend or recrop for a new aspect, remove or replace a background, upscale, or a bounded local correction",
        "the region the edit may touch, and the assertion the picture makes that it may not change",
        "whether the result supersedes the original or joins it as a derivative, with the original always retained",
        "output provenance recording that the published asset is an edit and what was edited"
      ],